name,referencePath,policyType,category,displayName,description,groupNames,policySets,allowedEffects,sandboxEffect,sandboxParameters,prodEffect,prodParameters
051cba44-2429-45b9-9649-46cec11c7119,,BuiltIn,API for FHIR,Azure API for FHIR should use a customer-managed key to encrypt data at rest,Use a customer-managed key to control the encryption at rest of the data stored in Azure API for FHIR when this is a regulatory or compliance requirement. Customer-managed keys also deliver double encryption by adding a second layer of encryption on top of the default one done with service-managed keys.,"Azure_Security_Benchmark_v3.0_DP-5,EU_2555_(NIS2)_2022_21,ISO_IEC_27001_2022_7.5.3,NIST_SP_800-53_R5_SC-12","MCSB-V2: disabled (override)),NIST-800-53: disabled (override)),NIS2-EU-2022: Disabled (assignment: effect-051cba44-2429-45b9-9649-46cec11c7119),ISO/IEC 27001 2022: Disabled (assignment: effect-051cba44-2429-45b9-9649-46cec11c7119)","parameter: Audit,Disabled",Disabled,,Disabled,
1ee56206-5dd1-42ab-b02d-8aae8b1634ce,,BuiltIn,API for FHIR,Azure API for FHIR should use private link,"Azure API for FHIR should have at least one approved private endpoint connection. Clients in a virtual network can securely access resources that have private endpoint connections through private links. For more information, visit: https://aka.ms/fhir-privatelink.","Azure_Security_Benchmark_v3.0_NS-2,NIST_SP_800-53_R5_AC-17,NIST_SP_800-53_R5_AC-17(1),NIST_SP_800-53_R5_AC-4,NIST_SP_800-53_R5_SC-7,NIST_SP_800-53_R5_SC-7(3)","MCSB-V2: Audit (Policy Default),NIST-800-53: Audit (Policy Default)","override: Audit,Disabled",Audit,,Audit,
0fea8f8a-4169-495d-8307-30ec335f387d,,BuiltIn,API for FHIR,CORS should not allow every domain to access your API for FHIR,"Cross-Origin Resource Sharing (CORS) should not allow all domains to access your API for FHIR. To protect your API for FHIR, remove access for all domains and explicitly define the domains allowed to connect.",EU_2555_(NIS2)_2022_21,NIS2-EU-2022: Audit (default: effect-0fea8f8a-4169-495d-8307-30ec335f387d),"parameter: Audit,Disabled",Audit,,Audit,
ee7495e7-3ba7-40b6-bfee-c29e22cc75d4,,BuiltIn,API Management,API Management APIs should use only encrypted protocols,"To ensure security of data in transit, APIs should be available only through encrypted protocols, like HTTPS or WSS. Avoid using unsecured protocols, such as HTTP or WS.",Azure_Security_Benchmark_v3.0_DP-3,"MCSB: Audit (Policy Default),MCSB-V2: Audit (Policy Default)","override: Deny,Audit,Disabled",Audit,,Audit,
c15dcc82-b93c-4dcb-9332-fbf121685b54,,BuiltIn,API Management,API Management calls to API backends should be authenticated,"Calls from API Management to backends should use some form of authentication, whether via certificates or credentials. Does not apply to Service Fabric backends.",Azure_Security_Benchmark_v3.0_IM-4,"MCSB: Audit (Policy Default),MCSB-V2: Audit (Policy Default)","override: Deny,Audit,Disabled",Audit,,Audit,
92bb331d-ac71-416a-8c91-02f2cb734ce4,,BuiltIn,API Management,API Management calls to API backends should not bypass certificate thumbprint or name validation,"To improve the API security, API Management should validate the backend server certificate for all API calls. Enable SSL certificate thumbprint and name validation.",Azure_Security_Benchmark_v3.0_IM-4,"MCSB: Audit (Policy Default),MCSB-V2: Audit (Policy Default)","override: Deny,Audit,Disabled",Audit,,Audit,
b741306c-968e-4b67-b916-5675e5c709f4,,BuiltIn,API Management,API Management direct management endpoint should not be enabled,"The direct management REST API in Azure API Management bypasses Azure Resource Manager role-based access control, authorization, and throttling mechanisms, thus increasing the vulnerability of your service.",Azure_Security_Benchmark_v3.0_PV-2,"MCSB: Audit (Policy Default),MCSB-V2: Audit (Policy Default)","override: Deny,Audit,Disabled",Audit,,Audit,
f1cc7827-022c-473e-836e-5a51cae0b249,,BuiltIn,API Management,API Management secret named values should be stored in Azure Key Vault,"Named values are a collection of name and value pairs in each API Management service. Secret values can be stored either as encrypted text in API Management (custom secrets) or by referencing secrets in Azure Key Vault. To improve security of API Management and secrets, reference secret named values from Azure Key Vault. Azure Key Vault supports granular access management and secret rotation policies.","Azure_Security_Benchmark_v3.0_DP-6,Azure_Security_Benchmark_v3.0_IM-8","MCSB: Audit (Policy Default),MCSB-V2: Audit (Policy Default)","override: Deny,Audit,Disabled",Audit,,Audit,
ef619a2c-cc4d-4d03-b2ba-8c94a834d85b,,BuiltIn,API Management,API Management services should use a virtual network,"Azure Virtual Network deployment provides enhanced security, isolation and allows you to place your API Management service in a non-internet routable network that you control access to. These networks can then be connected to your on-premises networks using various VPN technologies, which enables access to your backend services within the network and/or on-premises. The developer portal and API gateway, can be configured to be accessible either from the Internet or only within the virtual network.","Azure_Security_Benchmark_v3.0_NS-2,NIST_SP_800-53_R5_AC-4,NIST_SP_800-53_R5_SC-7,NIST_SP_800-53_R5_SC-7(3)","MCSB: Audit (default: aPIManagementServicesShouldUseAVirtualNetworkMonitoringEffect),MCSB-V2: Audit (Policy Default),NIST-800-53: Audit (Policy Default)","parameter: Deny,Audit,Disabled",Audit,"{""evaluatedSkuNames-ef619a2c-cc4d-4d03-b2ba-8c94a834d85b"":[""Developer"",""Premium""],""aPIManagementServicesShouldUseAVirtualNetworkEvaluatedSkuNames"":[""Developer"",""Premium""]}",Audit,"{""evaluatedSkuNames-ef619a2c-cc4d-4d03-b2ba-8c94a834d85b"":[""Developer"",""Premium""],""aPIManagementServicesShouldUseAVirtualNetworkEvaluatedSkuNames"":[""Developer"",""Premium""]}"
df73bd95-24da-4a4f-96b9-4e8b94b402bd,,BuiltIn,API Management,API Management should disable public network access to the service configuration endpoints,"To improve the security of API Management services, restrict connectivity to service configuration endpoints, like direct access management API, Git configuration management endpoint, or self-hosted gateways configuration endpoint.","Azure_Security_Benchmark_v3.0_NS-2,EU_2555_(NIS2)_2022_21,NIS2_PV._Posture_and_Vulnerability_Management_5,NIST_CSF_v2.0_PR.AA_05","MCSB: AuditIfNotExists (Policy Default),MCSB-V2: AuditIfNotExists (Policy Default),NIS2-Preview: AuditIfNotExists (Policy Default),NIS2-EU-2022: AuditIfNotExists (default: effect-df73bd95-24da-4a4f-96b9-4e8b94b402bd),NIST CSF V2: AuditIfNotExists (default: effect-df73bd95-24da-4a4f-96b9-4e8b94b402bd)","parameter: AuditIfNotExists,Disabled",AuditIfNotExists,"{""endpointType-df73bd95-24da-4a4f-96b9-4e8b94b402bd"":""Management"",""endpointType-1"":""Management""}",AuditIfNotExists,"{""endpointType-df73bd95-24da-4a4f-96b9-4e8b94b402bd"":""Management"",""endpointType-1"":""Management""}"
3aa03346-d8c5-4994-a5bc-7652c2a2aef1,,BuiltIn,API Management,API Management subscriptions should not be scoped to all APIs,"API Management subscriptions should be scoped to a product or an individual API instead of all APIs, which could result in an excessive data exposure.","Azure_Security_Benchmark_v3.0_PA-7,NIS2_AM._Asset_Management_9","MCSB: Audit (Policy Default),MCSB-V2: Audit (Policy Default),NIS2-Preview: Audit (Policy Default)","override: Deny,Audit,Disabled",Audit,,Audit,
1dc2fc00-2245-4143-99f4-874c937f13ef,,BuiltIn,API Management,Azure API Management platform version should be stv2,"Azure API Management stv1 compute platform version will be retired effective 31 August 2024, and these instances should be migrated to stv2 compute platform for continued support. Learn more at https://learn.microsoft.com/azure/api-management/breaking-changes/stv1-platform-retirement-august-2024","Azure_Security_Benchmark_v3.0_AM-2,Azure_Security_Benchmark_v3.0_PV-2,EU_2555_(NIS2)_2022_21","MCSB: Audit (Policy Default),MCSB-V2: Audit (Policy Default),NIS2-EU-2022: Audit (default: effect-1dc2fc00-2245-4143-99f4-874c937f13ef)","parameter: Deny,Audit,Disabled",Audit,,Audit,
3d9f5e4c-9947-4579-9539-2a7695fbc187,,BuiltIn,App Configuration,App Configuration should disable public network access,Disabling public network access improves security by ensuring that the resource isn't exposed on the public internet. You can limit exposure of your resources by creating private endpoints instead. Learn more at: https://aka.ms/appconfig/private-endpoint.,"Azure_Security_Benchmark_v3.0_NS-2,EU_2555_(NIS2)_2022_21,NIST_CSF_v2.0_PR.AA_05","MCSB-V2: Audit (Policy Default),NIS2-EU-2022: Audit (default: effect-3d9f5e4c-9947-4579-9539-2a7695fbc187),NIST CSF V2: Audit (default: effect-3d9f5e4c-9947-4579-9539-2a7695fbc187)","parameter: Deny,Audit,Disabled",Audit,,Audit,
967a4b4b-2da9-43c1-b7d0-f98d0d74d0b1,,BuiltIn,App Configuration,App Configuration should use a customer-managed key,Customer-managed keys provide enhanced data protection by allowing you to manage your encryption keys. This is often required to meet compliance requirements.,"EU_2555_(NIS2)_2022_21,ISO_IEC_27001_2022_7.5.3","NIS2-EU-2022: Audit (default: effect-967a4b4b-2da9-43c1-b7d0-f98d0d74d0b1),ISO/IEC 27001 2022: Audit (default: effect-967a4b4b-2da9-43c1-b7d0-f98d0d74d0b1)","parameter: Deny,Audit,Disabled",Audit,,Audit,
89c8a434-18f0-402c-8147-630a8dea54e0,,BuiltIn,App Configuration,App Configuration should use a SKU that supports private link,"When using a supported SKU, Azure Private Link lets you connect your virtual network to Azure services without a public IP address at the source or destination. The private link platform handles the connectivity between the consumer and services over the Azure backbone network. By mapping private endpoints to your app configuration instances instead of the entire service, you'll also be protected against data leakage risks. Learn more at: https://aka.ms/appconfig/private-endpoint.",Azure_Security_Benchmark_v3.0_NS-2,MCSB-V2: Audit (Policy Default),"override: Deny,Audit,Disabled",Audit,,Audit,
ca610c1d-041c-4332-9d88-7ed3094967c7,,BuiltIn,App Configuration,App Configuration should use private link,"Azure Private Link lets you connect your virtual network to Azure services without a public IP address at the source or destination. The private link platform handles the connectivity between the consumer and services over the Azure backbone network. By mapping private endpoints to your app configuration instances instead of the entire service, you'll also be protected against data leakage risks. Learn more at: https://aka.ms/appconfig/private-endpoint.","Azure_Security_Benchmark_v3.0_NS-2,NIST_SP_800-53_R5_AC-17,NIST_SP_800-53_R5_AC-17(1),NIST_SP_800-53_R5_AC-4,NIST_SP_800-53_R5_SC-7,NIST_SP_800-53_R5_SC-7(3)","MCSB: AuditIfNotExists (default: appConfigurationShouldUsePrivateLinkMonitoringEffect),MCSB-V2: AuditIfNotExists (Policy Default),NIST-800-53: AuditIfNotExists (Policy Default)","parameter: AuditIfNotExists,Disabled",AuditIfNotExists,,AuditIfNotExists,
af35e2a4-ef96-44e7-a9ae-853dd97032c4,,BuiltIn,App Platform,Azure Spring Cloud should use network injection,Azure Spring Cloud instances should use virtual network injection for the following purposes: 1. Isolate Azure Spring Cloud from Internet. 2. Enable Azure Spring Cloud to interact with systems in either on premises data centers or Azure service in other virtual networks. 3. Empower customers to control inbound and outbound network communications for Azure Spring Cloud.,"Azure_Security_Benchmark_v3.0_NS-2,EU_2555_(NIS2)_2022_21,NIST_SP_800-53_R5_AC-17,NIST_SP_800-53_R5_AC-17(1)","MCSB: Audit (default: azureSpringCloudShouldUseNetworkInjectionMonitoringEffect),MCSB-V2: Audit (Policy Default),NIST-800-53: Audit (default: effect-af35e2a4-ef96-44e7-a9ae-853dd97032c4),NIS2-EU-2022: Audit (default: effect-af35e2a4-ef96-44e7-a9ae-853dd97032c4)","parameter: Deny,Audit,Disabled",Audit,"{""evaluatedSkuNames-af35e2a4-ef96-44e7-a9ae-853dd97032c4"":[""Standard""]}",Audit,"{""evaluatedSkuNames-af35e2a4-ef96-44e7-a9ae-853dd97032c4"":[""Standard""]}"
701a595d-38fb-4a66-ae6d-fb3735217622,,BuiltIn,App Service,App Service app slots should disable public network access,Disabling public network access improves security by ensuring that the App Service is not exposed on the public internet. Creating private endpoints can limit exposure of an App Service. Learn more at: https://aka.ms/app-service-private-endpoint.,Azure_Security_Benchmark_v3.0_NS-2,MCSB-V2: Audit (Policy Default),"override: Deny,Audit,Disabled",Audit,,Audit,
123aed70-491a-4f07-a569-e1f3a8dd651e,,BuiltIn,App Service,App Service app slots should enable end to end encryption,Enabling end to end encryption ensures front-end intra-cluster traffic between App Service front-ends and the workers running application workloads is encrypted.,Azure_Security_Benchmark_v3.0_DP-3,MCSB-V2: Audit (Policy Default),"override: Deny,Audit,Disabled",Audit,,Audit,
4a15c15f-90d5-4a1f-8b63-2903944963fd,,BuiltIn,App Service,App Service app slots should use managed identity,Use a managed identity for enhanced authentication security,Azure_Security_Benchmark_v3.0_IM-3,MCSB-V2: AuditIfNotExists (Policy Default),"override: AuditIfNotExists,Disabled",AuditIfNotExists,,AuditIfNotExists,
4ee5b817-627a-435a-8932-116193268172,,BuiltIn,App Service,App Service app slots should use the latest TLS version,"Periodically, newer versions are released for TLS either due to security flaws, include additional functionality, and enhance speed. Upgrade to the latest TLS version for App Service apps to take advantage of security fixes, if any, and/or new functionalities of the latest version.",Azure_Security_Benchmark_v3.0_DP-3,MCSB-V2: AuditIfNotExists (Policy Default),"override: AuditIfNotExists,Disabled",AuditIfNotExists,,AuditIfNotExists,
1b5ef780-c53c-4a64-87f3-bb9c8c8094ba,,BuiltIn,App Service,App Service apps should disable public network access,Disabling public network access improves security by ensuring that the App Service is not exposed on the public internet. Creating private endpoints can limit exposure of an App Service. Learn more at: https://aka.ms/app-service-private-endpoint.,Azure_Security_Benchmark_v3.0_NS-2,MCSB-V2: Audit (Policy Default),"override: Deny,Audit,Disabled",Audit,,Audit,
af1d7e88-c1c8-4ea8-be1f-87bff0df9101,,BuiltIn,App Service,App Service apps should enable end to end encryption,Enabling end to end encryption ensures front-end intra-cluster traffic between App Service front-ends and the workers running application workloads is encrypted.,Azure_Security_Benchmark_v3.0_DP-3,MCSB-V2: Audit (Policy Default),"override: Deny,Audit,Disabled",Audit,,Audit,
95bccee9-a7f8-4bec-9ee9-62c3473701fc,,BuiltIn,App Service,App Service apps should have authentication enabled,"Azure App Service Authentication is a feature that can prevent anonymous HTTP requests from reaching the web app, or authenticate those that have tokens before they reach the web app.","EU_2555_(NIS2)_2022_21,NIST_CSF_v2.0_PR.AA_05","NIS2-EU-2022: AuditIfNotExists (default: effect-95bccee9-a7f8-4bec-9ee9-62c3473701fc),NIST CSF V2: AuditIfNotExists (default: effect-95bccee9-a7f8-4bec-9ee9-62c3473701fc)","parameter: AuditIfNotExists,Disabled",AuditIfNotExists,,AuditIfNotExists,
19dd1db6-f442-49cf-a838-b0786b4401ef,,BuiltIn,App Service,App Service apps should have Client Certificates (Incoming client certificates) enabled,Client certificates allow for the app to request a certificate for incoming requests. Only clients that have a valid certificate will be able to reach the app. This policy applies to apps with Http version set to 1.1.,"Azure_Security_Benchmark_v3.0_PV-2,EU_2555_(NIS2)_2022_21,NIST_CSF_v2.0_PR.DS_02,NIST_SP_800-53_R5_CM-6","MCSB: AuditIfNotExists (Policy Default),MCSB-V2: AuditIfNotExists (Policy Default),NIST-800-53: AuditIfNotExists (Policy Default),NIS2-EU-2022: AuditIfNotExists (default: effect-19dd1db6-f442-49cf-a838-b0786b4401ef),NIST CSF V2: AuditIfNotExists (default: effect-19dd1db6-f442-49cf-a838-b0786b4401ef)","parameter: AuditIfNotExists,Disabled",AuditIfNotExists,,AuditIfNotExists,
871b205b-57cf-4e1e-a234-492616998bf7,,BuiltIn,App Service,App Service apps should have local authentication methods disabled for FTP deployments,Disabling local authentication methods for FTP deployments improves security by ensuring that App Services exclusively require Microsoft Entra identities for authentication. Learn more at: https://aka.ms/app-service-disable-basic-auth.,Azure_Security_Benchmark_v3.0_IM-1,MCSB-V2: AuditIfNotExists (Policy Default),"override: AuditIfNotExists,Disabled",AuditIfNotExists,,AuditIfNotExists,
aede300b-d67f-480a-ae26-4b3dfb1a1fdc,,BuiltIn,App Service,App Service apps should have local authentication methods disabled for SCM site deployments,Disabling local authentication methods for SCM sites improves security by ensuring that App Services exclusively require Microsoft Entra identities for authentication. Learn more at: https://aka.ms/app-service-disable-basic-auth.,Azure_Security_Benchmark_v3.0_IM-1,MCSB-V2: AuditIfNotExists (Policy Default),"override: AuditIfNotExists,Disabled",AuditIfNotExists,,AuditIfNotExists,
cb510bfd-1cba-4d9f-a230-cb0976f4bb71,,BuiltIn,App Service,App Service apps should have remote debugging turned off,Remote debugging requires inbound ports to be opened on an App Service app. Remote debugging should be turned off.,"Azure_Security_Benchmark_v3.0_PV-2,EU_2555_(NIS2)_2022_21,NIST_SP_800-53_R5_AC-17,NIST_SP_800-53_R5_AC-17(1),NIST_SP_800-53_R5_CM-6","MCSB: AuditIfNotExists (default: webAppDisableRemoteDebuggingMonitoringEffect),MCSB-V2: AuditIfNotExists (Policy Default),NIST-800-53: AuditIfNotExists (Policy Default),NIS2-EU-2022: AuditIfNotExists (default: effect-cb510bfd-1cba-4d9f-a230-cb0976f4bb71)","parameter: AuditIfNotExists,Disabled",AuditIfNotExists,,AuditIfNotExists,
91a78b24-f231-4a8a-8da9-02c35b2b6510,,BuiltIn,App Service,App Service apps should have resource logs enabled,Audit enabling of resource logs on the app. This enables you to recreate activity trails for investigation purposes if a security incident occurs or your network is compromised.,"Azure_Security_Benchmark_v3.0_LT-3,NIST_SP_800-53_R5_AU-12,NIST_SP_800-53_R5_AU-12(1),NIST_SP_800-53_R5_AU-6(4),NIST_SP_800-53_R5_AU-6(5)","MCSB: AuditIfNotExists (default: diagnosticLogsInAppServicesShouldBeEnabledMonitoringEffect),MCSB-V2: AuditIfNotExists (Policy Default),NIST-800-53: AuditIfNotExists (Policy Default)","parameter: AuditIfNotExists,Disabled",AuditIfNotExists,,AuditIfNotExists,
5744710e-cc2f-4ee8-8809-3b11e89f4bc9,,BuiltIn,App Service,App Service apps should not have CORS configured to allow every resource to access your apps,Cross-Origin Resource Sharing (CORS) should not allow all domains to access your app. Allow only required domains to interact with your app.,"Azure_Security_Benchmark_v3.0_PV-2,NIST_SP_800-53_R5_AC-4,NIST_SP_800-53_R5_CM-6","MCSB: AuditIfNotExists (default: webAppRestrictCORSAccessMonitoringEffect),MCSB-V2: AuditIfNotExists (Policy Default),NIST-800-53: AuditIfNotExists (Policy Default)","parameter: AuditIfNotExists,Disabled",AuditIfNotExists,,AuditIfNotExists,
a4af4a39-4135-47fb-b175-47fbdf85311d,,BuiltIn,App Service,App Service apps should only be accessible over HTTPS,Use of HTTPS ensures server/service authentication and protects data in transit from network layer eavesdropping attacks.,"Azure_Security_Benchmark_v3.0_DP-3,NIS2_DP._Data_Protection_8,NIST_SP_800-53_R5_SC-8,NIST_SP_800-53_R5_SC-8(1)","MCSB: Audit (default: webAppEnforceHttpsMonitoringEffectV2),MCSB-V2: Audit (Policy Default),NIST-800-53: Audit (Policy Default),NIS2-Preview: Audit (Policy Default)","parameter: Deny,Audit,Disabled",Audit,,Audit,
4d24b6d4-5e53-4a4f-a7f4-618fa573ee4b,,BuiltIn,App Service,App Service apps should require FTPS only,Enable FTPS enforcement for enhanced security.,"Azure_Security_Benchmark_v3.0_DP-3,NIST_SP_800-53_R5_SC-8,NIST_SP_800-53_R5_SC-8(1)","MCSB: AuditIfNotExists (default: fTPSShouldBeRequiredInYourWebAppMonitoringEffect),MCSB-V2: AuditIfNotExists (Policy Default),NIST-800-53: AuditIfNotExists (Policy Default)","parameter: AuditIfNotExists,Disabled",AuditIfNotExists,,AuditIfNotExists,
546fe8d2-368d-4029-a418-6af48a7f61e5,,BuiltIn,App Service,App Service apps should use a SKU that supports private link,"With supported SKUs, Azure Private Link lets you connect your virtual network to Azure services without a public IP address at the source or destination. The Private Link platform handles the connectivity between the consumer and services over the Azure backbone network. By mapping private endpoints to apps, you can reduce data leakage risks. Learn more about private links at: https://aka.ms/private-link.",Azure_Security_Benchmark_v3.0_NS-2,MCSB-V2: Audit (Policy Default),"override: Deny,Audit,Disabled",Audit,,Audit,
8c122334-9d20-4eb8-89ea-ac9a705b74ae,,BuiltIn,App Service,App Service apps should use latest 'HTTP Version',"Periodically, newer versions are released for HTTP either due to security flaws or to include additional functionality. Using the latest HTTP version for web apps to take advantage of security fixes, if any, and/or new functionalities of the newer version.","NIST_SP_800-53_R5_SI-2,NIST_SP_800-53_R5_SI-2(6)",NIST-800-53: AuditIfNotExists (Policy Default),"override: AuditIfNotExists,Disabled",AuditIfNotExists,,AuditIfNotExists,
2b9ad585-36bc-4615-b300-fd4435808332,,BuiltIn,App Service,App Service apps should use managed identity,Use a managed identity for enhanced authentication security,"Azure_Security_Benchmark_v3.0_IM-3,NIST_SP_800-53_R5_AC-2,NIST_SP_800-53_R5_AC-3,NIST_SP_800-53_R5_IA-2,NIST_SP_800-53_R5_IA-4","MCSB: AuditIfNotExists (default: managedIdentityShouldBeUsedInYourWebAppMonitoringEffect),MCSB-V2: AuditIfNotExists (Policy Default),NIST-800-53: AuditIfNotExists (Policy Default)","parameter: AuditIfNotExists,Disabled",AuditIfNotExists,,AuditIfNotExists,
687aa49d-0982-40f8-bf6b-66d1da97a04b,,BuiltIn,App Service,App Service apps should use private link,"Azure Private Link lets you connect your virtual networks to Azure services without a public IP address at the source or destination. The Private Link platform handles the connectivity between the consumer and services over the Azure backbone network. By mapping private endpoints to App Service, you can reduce data leakage risks. Learn more about private links at: https://aka.ms/private-link.",Azure_Security_Benchmark_v3.0_NS-2,MCSB-V2: AuditIfNotExists (Policy Default),"override: AuditIfNotExists,Disabled",AuditIfNotExists,,AuditIfNotExists,
f0e6e85b-9b9f-4a4b-b67b-f730d42f1b0b,,BuiltIn,App Service,App Service apps should use the latest TLS version,"Periodically, newer versions are released for TLS either due to security flaws, include additional functionality, and enhance speed. Upgrade to the latest TLS version for App Service apps to take advantage of security fixes, if any, and/or new functionalities of the latest version.","Azure_Security_Benchmark_v3.0_DP-3,Azure_Security_Benchmark_v3.0_NS-8,NIST_SP_800-53_R5_SC-8,NIST_SP_800-53_R5_SC-8(1)","MCSB: AuditIfNotExists (default: latestTLSVersionShouldBeUsedInYourWebAppMonitoringEffect),MCSB-V2: AuditIfNotExists (Policy Default),NIST-800-53: AuditIfNotExists (Policy Default)","parameter: AuditIfNotExists,Disabled",AuditIfNotExists,,AuditIfNotExists,
2d048aca-6479-4923-88f5-e2ac295d9af3,,BuiltIn,App Service,App Service Environment apps should not be reachable over public internet,"To ensure apps deployed in an App Service Environment are not accessible over public internet, one should deploy App Service Environment with an IP address in virtual network. To set the IP address to a virtual network IP, the App Service Environment must be deployed with an internal load balancer.",Azure_Security_Benchmark_v3.0_NS-2,MCSB-V2: Audit (Policy Default),"override: Deny,Audit,Disabled",Audit,,Audit,
817dcf37-e83d-4999-a472-644eada2ea1e,,BuiltIn,App Service,App Service Environment should be configured with strongest TLS Cipher suites,The two most minimal and strongest cipher suites required for App Service Environment to function correctly are : TLS_ECDHE_RSA_WITH_AES_256_GCM_SHA384 and TLS_ECDHE_RSA_WITH_AES_128_GCM_SHA256.,Azure_Security_Benchmark_v3.0_DP-3,MCSB-V2: Audit (Policy Default),"override: Audit,Disabled",Audit,,Audit,
fb74e86f-d351-4b8d-b034-93da7391c01f,,BuiltIn,App Service,App Service Environment should have internal encryption enabled,"Setting InternalEncryption to true encrypts the pagefile, worker disks, and internal network traffic between the front ends and workers in an App Service Environment. To learn more, refer to https://docs.microsoft.com/azure/app-service/environment/app-service-app-service-environment-custom-settings#enable-internal-encryption.","Azure_Security_Benchmark_v3.0_DP-3,NIST_SP_800-53_R5_SC-28,NIST_SP_800-53_R5_SC-28(1)","MCSB-V2: Audit (Policy Default),NIST-800-53: Audit (Policy Default)","override: Audit,Disabled",Audit,,Audit,
d6545c6b-dd9d-4265-91e6-0b451e2f1c50,,BuiltIn,App Service,App Service Environment should have TLS 1.0 and 1.1 disabled,TLS 1.0 and 1.1 are out-of-date protocols that do not support modern cryptographic algorithms. Disabling inbound TLS 1.0 and 1.1 traffic helps secure apps in an App Service Environment.,Azure_Security_Benchmark_v3.0_DP-3,MCSB-V2: Audit (Policy Default),"override: Deny,Audit,Disabled",Audit,,Audit,
