name,referencePath,policyType,category,displayName,description,groupNames,policySets,allowedEffects,sandboxEffect,sandboxParameters,prodEffect,prodParameters
e6f7b584-877a-0d69-77d4-ab8b923a9650,,BuiltIn,Regulatory Compliance,Document separation of duties,CMA_0204 - Document separation of duties,NIST_SP_800-53_R5_AC-5,NIST-800-53: Manual (Policy Default),"override: Manual,Disabled",Manual,,Manual,
c148208b-1a6f-a4ac-7abc-23b1d41121b1,,BuiltIn,Regulatory Compliance,Document the information system environment in acquisition contracts,CMA_0205 - Document the information system environment in acquisition contracts,"NIST_SP_800-53_R5_SA-10,NIST_SP_800-53_R5_SA-4",NIST-800-53: Manual (Policy Default),"override: Manual,Disabled",Manual,,Manual,
77acc53d-0f67-6e06-7d04-5750653d4629,,BuiltIn,Regulatory Compliance,Document the protection of cardholder data in third party contracts,CMA_0207 - Document the protection of cardholder data in third party contracts,NIST_SP_800-53_R5_SA-4,NIST-800-53: Manual (Policy Default),"override: Manual,Disabled",Manual,,Manual,
b320aa42-33b4-53af-87ce-100091d48918,,BuiltIn,Regulatory Compliance,Document third-party personnel security requirements,CMA_C1531 - Document third-party personnel security requirements,NIST_SP_800-53_R5_PS-7,NIST-800-53: Manual (Policy Default),"override: Manual,Disabled",Manual,,Manual,
8f835d6a-4d13-9a9c-37dc-176cebd37fda,,BuiltIn,Regulatory Compliance,Document wireless access security controls,CMA_C1695 - Document wireless access security controls,NIST_SP_800-53_R5_SI-4(14),NIST-800-53: Manual (Policy Default),"override: Manual,Disabled",Manual,,Manual,
eaaae23f-92c9-4460-51cf-913feaea4d52,,BuiltIn,Regulatory Compliance,Employ a media sanitization mechanism,CMA_0208 - Employ a media sanitization mechanism,"NIST_SP_800-53_R5_MA-2,NIST_SP_800-53_R5_MA-3(3),NIST_SP_800-53_R5_MA-5(1),NIST_SP_800-53_R5_MP-4,NIST_SP_800-53_R5_MP-6,NIST_SP_800-53_R5_MP-6(1),NIST_SP_800-53_R5_MP-6(2)",NIST-800-53: Manual (Policy Default),"override: Manual,Disabled",Manual,,Manual,
c8aa992d-76b7-7ca0-07b3-31a58d773fa9,,BuiltIn,Regulatory Compliance,Employ automated training environment,CMA_C1357 - Employ automated training environment,NIST_SP_800-53_R5_IR-2(2),NIST-800-53: Manual (Policy Default),"override: Manual,Disabled",Manual,,Manual,
aa892c0d-2c40-200c-0dd8-eac8c4748ede,,BuiltIn,Regulatory Compliance,Employ automatic emergency lighting,CMA_0209 - Employ automatic emergency lighting,NIST_SP_800-53_R5_PE-12,NIST-800-53: Manual (Policy Default),"override: Manual,Disabled",Manual,,Manual,
1b8a7ec3-11cc-a2d3-8cd0-eedf074424a4,,BuiltIn,Regulatory Compliance,Employ automatic shutdown/restart when violations are detected,CMA_C1715 - Employ automatic shutdown/restart when violations are detected,NIST_SP_800-53_R5_SI-7(5),NIST-800-53: Manual (Policy Default),"override: Manual,Disabled",Manual,,Manual,
311802f9-098d-0659-245a-94c5d47c0182,,BuiltIn,Regulatory Compliance,Employ boundary protection to isolate information systems,CMA_C1639 - Employ boundary protection to isolate information systems,NIST_SP_800-53_R5_SC-7(21),NIST-800-53: Manual (Policy Default),"override: Manual,Disabled",Manual,,Manual,
8b333332-6efd-7c0d-5a9f-d1eb95105214,,BuiltIn,Regulatory Compliance,Employ FIPS 201-approved technology for PIV,CMA_C1579 - Employ FIPS 201-approved technology for PIV,NIST_SP_800-53_R5_SA-4(10),NIST-800-53: Manual (Policy Default),"override: Manual,Disabled",Manual,,Manual,
79365f13-8ba4-1f6c-2ac4-aa39929f56d0,,BuiltIn,Regulatory Compliance,Employ flow control mechanisms of encrypted information,CMA_0211 - Employ flow control mechanisms of encrypted information,NIST_SP_800-53_R5_AC-4,NIST-800-53: Manual (Policy Default),"override: Manual,Disabled",Manual,,Manual,
3baee3fd-30f5-882c-018c-cc78703a0106,,BuiltIn,Regulatory Compliance,Employ independent assessors for continuous monitoring,CMA_C1168 - Employ independent assessors for continuous monitoring,NIST_SP_800-53_R5_CA-7(1),NIST-800-53: Manual (Policy Default),"override: Manual,Disabled",Manual,,Manual,
b65c5d8e-9043-9612-2c17-65f231d763bb,,BuiltIn,Regulatory Compliance,Employ independent assessors to conduct security control assessments,CMA_C1148 - Employ independent assessors to conduct security control assessments,NIST_SP_800-53_R5_CA-2(1),NIST-800-53: Manual (Policy Default),"override: Manual,Disabled",Manual,,Manual,
611ebc63-8600-50b6-a0e3-fef272457132,,BuiltIn,Regulatory Compliance,Employ independent team for penetration testing,CMA_C1171 - Employ independent team for penetration testing,NIST_SP_800-53_R5_CA-8(1),NIST-800-53: Manual (Policy Default),"override: Manual,Disabled",Manual,,Manual,
1bc7fd64-291f-028e-4ed6-6e07886e163f,,BuiltIn,Regulatory Compliance,Employ least privilege access,CMA_0212 - Employ least privilege access,NIST_SP_800-53_R5_AC-6,NIST-800-53: Manual (Policy Default),"override: Manual,Disabled",Manual,,Manual,
426c172c-9914-10d1-25dd-669641fc1af4,,BuiltIn,Regulatory Compliance,Enable detection of network devices,CMA_0220 - Enable detection of network devices,NIST_SP_800-53_R5_CM-8(3),NIST-800-53: Manual (Policy Default),"override: Manual,Disabled",Manual,,Manual,
2c843d78-8f64-92b5-6a9b-e8186c0e7eb6,,BuiltIn,Regulatory Compliance,Enable dual or joint authorization,CMA_0226 - Enable dual or joint authorization,NIST_SP_800-53_R5_AU-9,NIST-800-53: Manual (Policy Default),"override: Manual,Disabled",Manual,,Manual,
8c255136-994b-9616-79f5-ae87810e0dcf,,BuiltIn,Regulatory Compliance,Enable network protection,CMA_0238 - Enable network protection,"NIST_SP_800-53_R5_IR-4,NIST_SP_800-53_R5_IR-4(1),NIST_SP_800-53_R5_IR-7(1)",NIST-800-53: Manual (Policy Default),"override: Manual,Disabled",Manual,,Manual,
b4409bff-2287-8407-05fd-c73175a68302,,BuiltIn,Regulatory Compliance,Enforce a limit of consecutive failed login attempts,CMA_C1044 - Enforce a limit of consecutive failed login attempts,NIST_SP_800-53_R5_AC-7,NIST-800-53: Manual (Policy Default),"override: Manual,Disabled",Manual,,Manual,
8cd815bf-97e1-5144-0735-11f6ddb50a59,,BuiltIn,Regulatory Compliance,Enforce and audit access restrictions,CMA_C1203 - Enforce and audit access restrictions,NIST_SP_800-53_R5_CM-5(1),NIST-800-53: Manual (Policy Default),"override: Manual,Disabled",Manual,,Manual,
fd81a1b3-2d7a-107c-507e-29b87d040c19,,BuiltIn,Regulatory Compliance,Enforce appropriate usage of all accounts,CMA_C1023 - Enforce appropriate usage of all accounts,NIST_SP_800-53_R5_AC-2(11),NIST-800-53: Manual (Policy Default),"override: Manual,Disabled",Manual,,Manual,
c7e8ddc1-14aa-1814-7fe1-aad1742b27da,,BuiltIn,Regulatory Compliance,Enforce expiration of cached authenticators,CMA_C1343 - Enforce expiration of cached authenticators,NIST_SP_800-53_R5_IA-5(13),NIST-800-53: Manual (Policy Default),"override: Manual,Disabled",Manual,,Manual,
10c4210b-3ec9-9603-050d-77e4d26c7ebb,,BuiltIn,Regulatory Compliance,Enforce logical access,CMA_0245 - Enforce logical access,NIST_SP_800-53_R5_AC-3,NIST-800-53: Manual (Policy Default),"override: Manual,Disabled",Manual,,Manual,
b1666a13-8f67-9c47-155e-69e027ff6823,,BuiltIn,Regulatory Compliance,Enforce mandatory and discretionary access control policies,CMA_0246 - Enforce mandatory and discretionary access control policies,"NIST_SP_800-53_R5_AC-1,NIST_SP_800-53_R5_AC-3,NIST_SP_800-53_R5_AC-6(1)",NIST-800-53: Manual (Policy Default),"override: Manual,Disabled",Manual,,Manual,
c7d57a6a-7cc2-66c0-299f-83bf90558f5d,,BuiltIn,Regulatory Compliance,Enforce random unique session identifiers,CMA_0247 - Enforce random unique session identifiers,NIST_SP_800-53_R5_SC-23,NIST-800-53: Manual (Policy Default),"override: Manual,Disabled",Manual,,Manual,
509552f5-6528-3540-7959-fbeae4832533,,BuiltIn,Regulatory Compliance,Enforce rules of behavior and access agreements,CMA_0248 - Enforce rules of behavior and access agreements,"NIST_SP_800-53_R5_PL-4,NIST_SP_800-53_R5_PS-6",NIST-800-53: Manual (Policy Default),"override: Manual,Disabled",Manual,,Manual,
058e9719-1ff9-3653-4230-23f76b6492e0,,BuiltIn,Regulatory Compliance,Enforce security configuration settings,CMA_0249 - Enforce security configuration settings,"NIST_SP_800-53_R5_CM-2,NIST_SP_800-53_R5_CM-2(2),NIST_SP_800-53_R5_CM-6,NIST_SP_800-53_R5_CM-6(1)",NIST-800-53: Manual (Policy Default),"override: Manual,Disabled",Manual,,Manual,
68d2e478-3b19-23eb-1357-31b296547457,,BuiltIn,Regulatory Compliance,Enforce software execution privileges,CMA_C1041 - Enforce software execution privileges,NIST_SP_800-53_R5_AC-6(8),NIST-800-53: Manual (Policy Default),"override: Manual,Disabled",Manual,,Manual,
e336d5f4-4d8f-0059-759c-ae10f63d1747,,BuiltIn,Regulatory Compliance,Enforce user uniqueness,CMA_0250 - Enforce user uniqueness,NIST_SP_800-53_R5_IA-2,NIST-800-53: Manual (Policy Default),"override: Manual,Disabled",Manual,,Manual,
e7589f4e-1e8b-72c2-3692-1e14d7f3699f,,BuiltIn,Regulatory Compliance,Ensure access agreements are signed or resigned timely,CMA_C1528 - Ensure access agreements are signed or resigned timely,NIST_SP_800-53_R5_PS-6,NIST-800-53: Manual (Policy Default),"override: Manual,Disabled",Manual,,Manual,
178c8b7e-1b6e-4289-44dd-2f1526b678a1,,BuiltIn,Regulatory Compliance,Ensure alternate storage site safeguards are equivalent to primary site,CMA_C1268 - Ensure alternate storage site safeguards are equivalent to primary site,NIST_SP_800-53_R5_CP-6,NIST-800-53: Manual (Policy Default),"override: Manual,Disabled",Manual,,Manual,
27ce30dd-3d56-8b54-6144-e26d9a37a541,,BuiltIn,Regulatory Compliance,Ensure audit records are not altered,CMA_C1125 - Ensure audit records are not altered,NIST_SP_800-53_R5_AU-7,NIST-800-53: Manual (Policy Default),"override: Manual,Disabled",Manual,,Manual,
37dbe3dc-0e9c-24fa-36f2-11197cbfa207,,BuiltIn,Regulatory Compliance,Ensure authorized users protect provided authenticators,CMA_C1339 - Ensure authorized users protect provided authenticators,NIST_SP_800-53_R5_IA-5(6),NIST-800-53: Manual (Policy Default),"override: Manual,Disabled",Manual,,Manual,
b8dad106-6444-5f55-307e-1e1cc9723e39,,BuiltIn,Regulatory Compliance,Ensure cryptographic mechanisms are under configuration management,CMA_C1199 - Ensure cryptographic mechanisms are under configuration management,NIST_SP_800-53_R5_CM-3(6),NIST-800-53: Manual (Policy Default),"override: Manual,Disabled",Manual,,Manual,
3eabed6d-1912-2d3c-858b-f438d08d0412,,BuiltIn,Regulatory Compliance,Ensure external providers consistently meet interests of the customers,CMA_C1592 - Ensure external providers consistently meet interests of the customers,NIST_SP_800-53_R5_SA-9(4),NIST-800-53: Manual (Policy Default),"override: Manual,Disabled",Manual,,Manual,
12af7c7a-92af-9e96-0d0c-5e732d1a3751,,BuiltIn,Regulatory Compliance,Ensure information system fails in known state,CMA_C1662 - Ensure information system fails in known state,NIST_SP_800-53_R5_SC-24,NIST-800-53: Manual (Policy Default),"override: Manual,Disabled",Manual,,Manual,
0716f0f5-4955-2ccb-8d5e-c6be14d57c0f,,BuiltIn,Regulatory Compliance,Ensure resources are authorized,CMA_C1159 - Ensure resources are authorized,NIST_SP_800-53_R5_CA-6,NIST-800-53: Manual (Policy Default),"override: Manual,Disabled",Manual,,Manual,
6c79c3e5-5f7b-a48a-5c7b-8c158bc01115,,BuiltIn,Regulatory Compliance,Ensure security categorization is approved,CMA_C1540 - Ensure security categorization is approved,NIST_SP_800-53_R5_RA-2,NIST-800-53: Manual (Policy Default),"override: Manual,Disabled",Manual,,Manual,
1fdf0b24-4043-3c55-357e-036985d50b52,,BuiltIn,Regulatory Compliance,Ensure security safeguards not needed when the individuals return,CMA_C1183 - Ensure security safeguards not needed when the individuals return,NIST_SP_800-53_R5_CM-2(7),NIST-800-53: Manual (Policy Default),"override: Manual,Disabled",Manual,,Manual,
83eea3d3-0d2c-9ccd-1021-2111b29b2a62,,BuiltIn,Regulatory Compliance,Ensure system capable of dynamic isolation of resources,CMA_C1638 - Ensure system capable of dynamic isolation of resources,NIST_SP_800-53_R5_SC-7(20),NIST-800-53: Manual (Policy Default),"override: Manual,Disabled",Manual,,Manual,
eda0cbb7-6043-05bf-645b-67411f1a59b3,,BuiltIn,Regulatory Compliance,Ensure there are no unencrypted static authenticators,CMA_C1340 - Ensure there are no unencrypted static authenticators,NIST_SP_800-53_R5_IA-5(7),NIST-800-53: Manual (Policy Default),"override: Manual,Disabled",Manual,,Manual,
54a9c072-4a93-2a03-6a43-a060d30383d7,,BuiltIn,Regulatory Compliance,Eradicate contaminated information,CMA_0253 - Eradicate contaminated information,"NIST_SP_800-53_R5_IR-4,NIST_SP_800-53_R5_IR-7(1),NIST_SP_800-53_R5_IR-9",NIST-800-53: Manual (Policy Default),"override: Manual,Disabled",Manual,,Manual,
7380631c-5bf5-0e3a-4509-0873becd8a63,,BuiltIn,Regulatory Compliance,Establish a configuration control board,CMA_0254 - Establish a configuration control board,"NIST_SP_800-53_R5_CM-2,NIST_SP_800-53_R5_CM-2(2)",NIST-800-53: Manual (Policy Default),"override: Manual,Disabled",Manual,,Manual,
3c9aa856-6b86-35dc-83f4-bc72cec74dea,,BuiltIn,Regulatory Compliance,Establish a data leakage management procedure,CMA_0255 - Establish a data leakage management procedure,NIST_SP_800-53_R5_SC-28,NIST-800-53: Manual (Policy Default),"override: Manual,Disabled",Manual,,Manual,
06af77de-02ca-0f3e-838a-a9420fe466f5,,BuiltIn,Regulatory Compliance,Establish a discrete line item in budgeting documentation,CMA_C1563 - Establish a discrete line item in budgeting documentation,NIST_SP_800-53_R5_SA-2,NIST-800-53: Manual (Policy Default),"override: Manual,Disabled",Manual,,Manual,
d8bbd80e-3bb1-5983-06c2-428526ec6a63,,BuiltIn,Regulatory Compliance,Establish a password policy,CMA_0256 - Establish a password policy,NIST_SP_800-53_R5_IA-5(1),NIST-800-53: Manual (Policy Default),"override: Manual,Disabled",Manual,,Manual,
39eb03c1-97cc-11ab-0960-6209ed2869f7,,BuiltIn,Regulatory Compliance,Establish a privacy program,CMA_0257 - Establish a privacy program,"NIST_SP_800-53_R5_PL-2,NIST_SP_800-53_R5_SA-2",NIST-800-53: Manual (Policy Default),"override: Manual,Disabled",Manual,,Manual,
d36700f2-2f0d-7c2a-059c-bdadd1d79f70,,BuiltIn,Regulatory Compliance,Establish a risk management strategy,CMA_0258 - Establish a risk management strategy,"NIST_SP_800-53_R5_CM-3,NIST_SP_800-53_R5_CM-4",NIST-800-53: Manual (Policy Default),"override: Manual,Disabled",Manual,,Manual,
e750ca06-1824-464a-2cf3-d0fa754d1cb4,,BuiltIn,Regulatory Compliance,Establish a secure software development program,CMA_0259 - Establish a secure software development program,NIST_SP_800-53_R5_SA-10,NIST-800-53: Manual (Policy Default),"override: Manual,Disabled",Manual,,Manual,
b0e3035d-6366-2e37-796e-8bcab9c649e6,,BuiltIn,Regulatory Compliance,Establish a threat intelligence program,CMA_0260 - Establish a threat intelligence program,NIST_SP_800-53_R5_SI-5,NIST-800-53: Manual (Policy Default),"override: Manual,Disabled",Manual,,Manual,
245fe58b-96f8-9f1e-48c5-7f49903f66fd,,BuiltIn,Regulatory Compliance,Establish alternate storage site that facilitates recovery operations,CMA_C1270 - Establish alternate storage site that facilitates recovery operations,NIST_SP_800-53_R5_CP-6(2),NIST-800-53: Manual (Policy Default),"override: Manual,Disabled",Manual,,Manual,
0a412110-3874-9f22-187a-c7a81c8a6704,,BuiltIn,Regulatory Compliance,Establish alternate storage site to store and retrieve backup information,CMA_C1267 - Establish alternate storage site to store and retrieve backup information,"EU_2555_(NIS2)_2022_9,NIST_SP_800-53_R5_CP-6","NIST-800-53: Manual (Policy Default),NIS2-EU-2022: Manual (default: effect-0a412110-3874-9f22-187a-c7a81c8a6704)","parameter: Manual,Disabled",Manual,,Manual,
af5ff768-a34b-720e-1224-e6b3214f3ba6,,BuiltIn,Regulatory Compliance,Establish an alternate processing site,CMA_0262 - Establish an alternate processing site,"NIST_SP_800-53_R5_CP-7,NIST_SP_800-53_R5_CP-7(1),NIST_SP_800-53_R5_CP-7(2),NIST_SP_800-53_R5_CP-7(3)",NIST-800-53: Manual (Policy Default),"override: Manual,Disabled",Manual,,Manual,
84245967-7882-54f6-2d34-85059f725b47,,BuiltIn,Regulatory Compliance,Establish an information security program,CMA_0263 - Establish an information security program,"NIST_SP_800-53_R5_IR-3,NIST_SP_800-53_R5_IR-3(2)",NIST-800-53: Manual (Policy Default),"override: Manual,Disabled",Manual,,Manual,
526ed90e-890f-69e7-0386-ba5c0f1f784f,,BuiltIn,Regulatory Compliance,Establish and document a configuration management plan,CMA_0264 - Establish and document a configuration management plan,"NIST_SP_800-53_R5_CM-2,NIST_SP_800-53_R5_CM-2(2),NIST_SP_800-53_R5_CM-9",NIST-800-53: Manual (Policy Default),"override: Manual,Disabled",Manual,,Manual,
bd4dc286-2f30-5b95-777c-681f3a7913d3,,BuiltIn,Regulatory Compliance,Establish and document change control processes,CMA_0265 - Establish and document change control processes,"NIST_SP_800-53_R5_CM-3,NIST_SP_800-53_R5_CM-3(2),NIST_SP_800-53_R5_CM-4,NIST_SP_800-53_R5_CM-4(1),NIST_SP_800-53_R5_CM-5",NIST-800-53: Manual (Policy Default),"override: Manual,Disabled",Manual,,Manual,
27965e62-141f-8cca-426f-d09514ee5216,,BuiltIn,Regulatory Compliance,Establish and maintain an asset inventory,CMA_0266 - Establish and maintain an asset inventory,"NIST_SP_800-53_R5_CM-8(4),NIST_SP_800-53_R5_PE-3",NIST-800-53: Manual (Policy Default),"override: Manual,Disabled",Manual,,Manual,
921ae4c1-507f-5ddb-8a58-cfa9b5fd96f0,,BuiltIn,Regulatory Compliance,Establish authenticator types and processes,CMA_0267 - Establish authenticator types and processes,"NIST_SP_800-53_R5_IA-5,NIST_SP_800-53_R5_IA-5(2)",NIST-800-53: Manual (Policy Default),"override: Manual,Disabled",Manual,,Manual,
4f23967c-a74b-9a09-9dc2-f566f61a87b9,,BuiltIn,Regulatory Compliance,Establish backup policies and procedures,CMA_0268 - Establish backup policies and procedures,"NIST_SP_800-53_R5_AU-9(2),NIST_SP_800-53_R5_CP-9",NIST-800-53: Manual (Policy Default),"override: Manual,Disabled",Manual,,Manual,
dd2523d5-2db3-642b-a1cf-83ac973b32c2,,BuiltIn,Regulatory Compliance,Establish benchmarks for flaw remediation,CMA_C1675 - Establish benchmarks for flaw remediation,NIST_SP_800-53_R5_SI-2(3),NIST-800-53: Manual (Policy Default),"override: Manual,Disabled",Manual,,Manual,
97cfd944-6f0c-7db2-3796-8e890ef70819,,BuiltIn,Regulatory Compliance,Establish conditions for role membership,CMA_0269 - Establish conditions for role membership,NIST_SP_800-53_R5_AC-2,NIST-800-53: Manual (Policy Default),"override: Manual,Disabled",Manual,,Manual,
8747b573-8294-86a0-8914-49e9b06a5ace,,BuiltIn,Regulatory Compliance,Establish configuration management requirements for developers,CMA_0270 - Establish configuration management requirements for developers,"NIST_SP_800-53_R5_CM-3,NIST_SP_800-53_R5_CM-3(2),NIST_SP_800-53_R5_CM-4,NIST_SP_800-53_R5_CM-4(1)",NIST-800-53: Manual (Policy Default),"override: Manual,Disabled",Manual,,Manual,
6f3866e8-6e12-69cf-788c-809d426094a1,,BuiltIn,Regulatory Compliance,Establish electronic signature and certificate requirements,CMA_0271 - Establish electronic signature and certificate requirements,NIST_SP_800-53_R5_AU-10,NIST-800-53: Manual (Policy Default),"override: Manual,Disabled",Manual,,Manual,
398fdbd8-56fd-274d-35c6-fa2d3b2755a1,,BuiltIn,Regulatory Compliance,Establish firewall and router configuration standards,CMA_0272 - Establish firewall and router configuration standards,NIST_SP_800-53_R5_AC-4(21),NIST-800-53: Manual (Policy Default),"override: Manual,Disabled",Manual,,Manual,
f476f3b0-4152-526e-a209-44e5f8c968d7,,BuiltIn,Regulatory Compliance,Establish network segmentation for card holder data environment,CMA_0273 - Establish network segmentation for card holder data environment,NIST_SP_800-53_R5_AC-4(21),NIST-800-53: Manual (Policy Default),"override: Manual,Disabled",Manual,,Manual,
0065241c-72e9-3b2c-556f-75de66332a94,,BuiltIn,Regulatory Compliance,Establish parameters for searching secret authenticators and verifiers,CMA_0274 - Establish parameters for searching secret authenticators and verifiers,NIST_SP_800-53_R5_IA-5(2),NIST-800-53: Manual (Policy Default),"override: Manual,Disabled",Manual,,Manual,
35963d41-4263-0ef9-98d5-70eb058f9e3c,,BuiltIn,Regulatory Compliance,Establish procedures for initial authenticator distribution,CMA_0276 - Establish procedures for initial authenticator distribution,"NIST_SP_800-53_R5_IA-5,NIST_SP_800-53_R5_IA-5(2)",NIST-800-53: Manual (Policy Default),"override: Manual,Disabled",Manual,,Manual,
b470a37a-7a47-3792-34dd-7a793140702e,,BuiltIn,Regulatory Compliance,Establish relationship between incident response capability and external providers,CMA_C1376 - Establish relationship between incident response capability and external providers,NIST_SP_800-53_R5_IR-7(2),NIST-800-53: Manual (Policy Default),"override: Manual,Disabled",Manual,,Manual,
b3c8cc83-20d3-3890-8bc8-5568777670f4,,BuiltIn,Regulatory Compliance,Establish requirements for audit review and reporting,CMA_0277 - Establish requirements for audit review and reporting,"NIST_SP_800-53_R5_AU-6,NIST_SP_800-53_R5_AU-6(1),NIST_SP_800-53_R5_RA-5(8)",NIST-800-53: Manual (Policy Default),"override: Manual,Disabled",Manual,,Manual,
5f2e834d-7e40-a4d5-a216-e49b16955ccf,,BuiltIn,Regulatory Compliance,Establish requirements for internet service providers,CMA_0278 - Establish requirements for internet service providers,"NIST_SP_800-53_R5_CP-7(3),NIST_SP_800-53_R5_CP-8(1)",NIST-800-53: Manual (Policy Default),"override: Manual,Disabled",Manual,,Manual,
afbecd30-37ee-a27b-8e09-6ac49951a0ee,,BuiltIn,Regulatory Compliance,Establish security requirements for the manufacturing of connected devices,CMA_0279 - Establish security requirements for the manufacturing of connected devices,NIST_SP_800-53_R5_PL-2,NIST-800-53: Manual (Policy Default),"override: Manual,Disabled",Manual,,Manual,
3c93dba1-84fd-57de-33c7-ef0400a08134,,BuiltIn,Regulatory Compliance,Establish terms and conditions for accessing resources,CMA_C1076 - Establish terms and conditions for accessing resources,NIST_SP_800-53_R5_AC-20,NIST-800-53: Manual (Policy Default),"override: Manual,Disabled",Manual,,Manual,
5715bf33-a5bd-1084-4e19-bc3c83ec1c35,,BuiltIn,Regulatory Compliance,Establish terms and conditions for processing resources,CMA_C1077 - Establish terms and conditions for processing resources,NIST_SP_800-53_R5_AC-20,NIST-800-53: Manual (Policy Default),"override: Manual,Disabled",Manual,,Manual,
3881168c-5d38-6f04-61cc-b5d87b2c4c58,,BuiltIn,Regulatory Compliance,Establish third-party personnel security requirements,CMA_C1529 - Establish third-party personnel security requirements,NIST_SP_800-53_R5_PS-7,NIST-800-53: Manual (Policy Default),"override: Manual,Disabled",Manual,,Manual,
ffdaa742-0d6f-726f-3eac-6e6c34e36c93,,BuiltIn,Regulatory Compliance,Establish usage restrictions for mobile code technologies,CMA_C1652 - Establish usage restrictions for mobile code technologies,NIST_SP_800-53_R5_SC-18,NIST-800-53: Manual (Policy Default),"override: Manual,Disabled",Manual,,Manual,
60442979-6333-85f0-84c5-b887bac67448,,BuiltIn,Regulatory Compliance,Evaluate alternate processing site capabilities,CMA_C1266 - Evaluate alternate processing site capabilities,NIST_SP_800-53_R5_CP-4(2),NIST-800-53: Manual (Policy Default),"override: Manual,Disabled",Manual,,Manual,
ba78efc6-795c-64f4-7a02-91effbd34af9,,BuiltIn,Regulatory Compliance,Execute actions in response to information spills,CMA_0281 - Execute actions in response to information spills,"NIST_SP_800-53_R5_IR-4,NIST_SP_800-53_R5_IR-7(1),NIST_SP_800-53_R5_IR-9",NIST-800-53: Manual (Policy Default),"override: Manual,Disabled",Manual,,Manual,
62fa14f0-4cbe-762d-5469-0899a99b98aa,,BuiltIn,Regulatory Compliance,Explicitly notify use of collaborative computing devices,CMA_C1649 - Explicitly notify use of collaborative computing devices,NIST_SP_800-53_R5_SC-15,NIST-800-53: Manual (Policy Default),"override: Manual,Disabled",Manual,,Manual,
a44c9fba-43f8-4b7b-7ee6-db52c96b4366,,BuiltIn,Regulatory Compliance,Facilitate information sharing,CMA_0284 - Facilitate information sharing,NIST_SP_800-53_R5_AC-21,NIST-800-53: Manual (Policy Default),"override: Manual,Disabled",Manual,,Manual,
c2cb4658-44dc-9d11-3dad-7c6802dd5ba3,,BuiltIn,Regulatory Compliance,Generate error messages,CMA_C1724 - Generate error messages,NIST_SP_800-53_R5_SI-11,NIST-800-53: Manual (Policy Default),"override: Manual,Disabled",Manual,,Manual,
171e377b-5224-4a97-1eaa-62a3b5231dac,,BuiltIn,Regulatory Compliance,Generate internal security alerts,CMA_C1704 - Generate internal security alerts,NIST_SP_800-53_R5_SI-5,NIST-800-53: Manual (Policy Default),"override: Manual,Disabled",Manual,,Manual,
333b4ada-4a02-0648-3d4d-d812974f1bb2,,BuiltIn,Regulatory Compliance,Govern and monitor audit processing activities,CMA_0289 - Govern and monitor audit processing activities,"NIS2_ES._Endpoint_Security_6,NIST_SP_800-53_R5_AU-4,NIST_SP_800-53_R5_AU-5","NIST-800-53: Manual (Policy Default),NIS2-Preview: Manual (Policy Default)","override: Manual,Disabled",Manual,,Manual,
5c33538e-02f8-0a7f-998b-a4c1e22076d3,,BuiltIn,Regulatory Compliance,Govern compliance of cloud service providers,CMA_0290 - Govern compliance of cloud service providers,NIST_SP_800-53_R5_CM-6(1),NIST-800-53: Manual (Policy Default),"override: Manual,Disabled",Manual,,Manual,
1a2a03a4-9992-5788-5953-d8f6615306de,,BuiltIn,Regulatory Compliance,Govern policies and procedures,CMA_0292 - Govern policies and procedures,"NIST_SP_800-53_R5_AC-1,NIST_SP_800-53_R5_AU-1",NIST-800-53: Manual (Policy Default),"override: Manual,Disabled",Manual,,Manual,
33d34fac-56a8-1c0f-0636-3ed94892a709,,BuiltIn,Regulatory Compliance,Govern the allocation of resources,CMA_0293 - Govern the allocation of resources,"NIST_SP_800-53_R5_SA-2,NIST_SP_800-53_R5_SC-6",NIST-800-53: Manual (Policy Default),"override: Manual,Disabled",Manual,,Manual,
92a7591f-73b3-1173-a09c-a08882d84c70,,BuiltIn,Regulatory Compliance,Identify actions allowed without authentication,CMA_0295 - Identify actions allowed without authentication,NIST_SP_800-53_R5_AC-14,NIST-800-53: Manual (Policy Default),"override: Manual,Disabled",Manual,,Manual,
