name,referencePath,policyType,category,displayName,description,groupNames,policySets,allowedEffects,sandboxEffect,sandboxParameters,prodEffect,prodParameters
1fd32ebd-e4c3-4e13-a54a-d7422d4d95f6,,BuiltIn,HDInsight,Azure HDInsight clusters should use encryption at host to encrypt data at rest,"Enabling encryption at host helps protect and safeguard your data to meet your organizational security and compliance commitments. When you enable encryption at host, data stored on the VM host is encrypted at rest and flows encrypted to the Storage service.","Azure_Security_Benchmark_v3.0_DP-4,NIST_SP_800-53_R5_SC-12","MCSB-V2: Audit (Policy Default),NIST-800-53: Audit (default: effect-1fd32ebd-e4c3-4e13-a54a-d7422d4d95f6)","parameter: Deny,Audit,Disabled",Audit,,Audit,
d9da03a1-f3c3-412a-9709-947156872263,,BuiltIn,HDInsight,Azure HDInsight clusters should use encryption in transit to encrypt communication between Azure HDInsight cluster nodes,Data can be tampered with during transmission between Azure HDInsight cluster nodes. Enabling encryption in transit addresses problems of misuse and tampering during this transmission.,"Azure_Security_Benchmark_v3.0_DP-3,NIST_SP_800-53_R5_SC-8,NIST_SP_800-53_R5_SC-8(1)","MCSB-V2: Audit (Policy Default),NIST-800-53: Audit (default: effect-d9da03a1-f3c3-412a-9709-947156872263)","parameter: Deny,Audit,Disabled",Audit,,Audit,
c8cc2f85-e019-4065-9fa3-5e6a2b2dde56,,BuiltIn,HDInsight,Azure HDInsight should use private link,"Azure Private Link lets you connect your virtual networks to Azure services without a public IP address at the source or destination. The Private Link platform handles the connectivity between the consumer and services over the Azure backbone network. By mapping private endpoints to Azure HDInsight clusters, you can reduce data leakage risks. Learn more about private links at: https://aka.ms/hdi.pl.",Azure_Security_Benchmark_v3.0_NS-2,MCSB-V2: AuditIfNotExists (Policy Default),"override: AuditIfNotExists,Disabled",AuditIfNotExists,,AuditIfNotExists,
4d080fa5-a6d2-4f98-ba9c-f482d0d335c0,,BuiltIn,Health Bot,Azure Health Bots should use customer-managed keys to encrypt data at rest,"Use customer-managed keys (CMK) to manage the encryption at rest of the data of your healthbots. By default, the data is encrypted at rest with service-managed keys, but CMK are commonly required to meet regulatory compliance standards. CMK enable the data to be encrypted with an Azure Key Vault key created and owned by you. You have full control and responsibility for the key lifecycle, including rotation and management. Learn more at https://docs.microsoft.com/azure/health-bot/cmk",Azure_Security_Benchmark_v3.0_DP-5,MCSB-V2: Audit (Policy Default),"override: Audit,Disabled",Audit,,Audit,
64528841-2f92-43f6-a137-d52e5c3dbeac,,BuiltIn,Health Data Services workspace,Azure Health Data Services workspace should use private link,"Health Data Services workspace should have at least one approved private endpoint connection. Clients in a virtual network can securely access resources that have private endpoint connections through private links. For more information, visit: https://aka.ms/healthcareapisprivatelink.",Azure_Security_Benchmark_v3.0_NS-2,MCSB-V2: Audit (Policy Default),"override: Audit,Disabled",Audit,,Audit,
c5f34731-7ab9-42ff-922d-ef4920068b74,,BuiltIn,Health Deidentification Service,Azure Health Data Services de-identification service should disable public network access,Disabling public network access improves security by ensuring that the resource isn't exposed on the public internet. You can limit exposure of your resources by creating private endpoints instead.,Azure_Security_Benchmark_v3.0_NS-2,MCSB-V2: Audit (Policy Default),"override: Audit,Disabled",Audit,,Audit,
d9b2d63d-a233-4123-847a-7f7e5f5d7e7a,,BuiltIn,Health Deidentification Service,Azure Health Data Services de-identification service should use private link,Azure Health Data Services de-identification service should have at least one approved private endpoint connection. Clients in a virtual network can securely access resources that have private endpoint connections through private links.,Azure_Security_Benchmark_v3.0_NS-2,MCSB-V2: Audit (Policy Default),"override: Audit,Disabled",Audit,,Audit,
14961b63-a1eb-4378-8725-7e84ca8db0e6,,BuiltIn,Healthcare APIs,DICOM Service should use a customer-managed key to encrypt data at rest,Use a customer-managed key to control the encryption at rest of the data stored in Azure Health Data Services DICOM Service when this is a regulatory or compliance requirement. Customer-managed keys also deliver double encryption by adding a second layer of encryption on top of the default one done with service-managed keys.,Azure_Security_Benchmark_v3.0_DP-5,MCSB-V2: Audit (Policy Default),"override: Audit,Disabled",Audit,,Audit,
c42dee8c-0202-4a12-bd8e-3e171cbf64dd,,BuiltIn,Healthcare APIs,FHIR Service should use a customer-managed key to encrypt data at rest,Use a customer-managed key to control the encryption at rest of the data stored in Azure Health Data Services FHIR Service when this is a regulatory or compliance requirement. Customer-managed keys also deliver double encryption by adding a second layer of encryption on top of the default one done with service-managed keys.,Azure_Security_Benchmark_v3.0_DP-5,MCSB-V2: Audit (Policy Default),"override: Audit,Disabled",Audit,,Audit,
47031206-ce96-41f8-861b-6a915f3de284,,BuiltIn,Internet of Things,[Preview]: IoT Hub device provisioning service data should be encrypted using customer-managed keys (CMK),"Use customer-managed keys to manage the encryption at rest of your IoT Hub device provisioning service. The data is automatically encrypted at rest with service-managed keys, but customer-managed keys (CMK) are commonly required to meet regulatory compliance standards. CMKs enable the data to be encrypted with an Azure Key Vault key created and owned by you. Learn more about CMK encryption at https://aka.ms/dps/CMK.","EU_2555_(NIS2)_2022_21,NIST_SP_800-53_R5_SC-12","NIST-800-53: Audit (default: effect-47031206-ce96-41f8-861b-6a915f3de284),NIS2-EU-2022: Audit (default: effect-47031206-ce96-41f8-861b-6a915f3de284)","parameter: Deny,Audit,Disabled",Audit,,Audit,
43c323f6-0329-4f7c-a19a-6e5a5690d042,,BuiltIn,Internet of Things,Azure Device Update accounts should use customer-managed key to encrypt data at rest,"Encryption of data at rest in Azure Device Update with customer-managed key adds a second layer of encryption on top of the default service-managed keys, enables customer control of keys, custom rotation policies, and ability to manage access to data through key access control. Learn more at:https://learn.microsoft.com/azure/iot-hub-device-update/device-update-data-encryption. ",Azure_Security_Benchmark_v3.0_DP-5,MCSB-V2: Audit (Policy Default),"override: Deny,Audit,Disabled",Audit,,Audit,
27d4c5ec-8820-443f-91fe-1215e96f64b2,,BuiltIn,Internet of Things,Azure Device Update for IoT Hub accounts should use private link,"Azure Private Link lets you connect your virtual network to Azure services without a public IP address at the source or destination. The Private Link platform handles the connectivity between the consumer and services over the Azure backbone network. By mapping private endpoints to Azure Device Update for IoT Hub accounts, data leakage risks are reduced.",Azure_Security_Benchmark_v3.0_NS-2,MCSB-V2: AuditIfNotExists (Policy Default),"override: AuditIfNotExists,Disabled",AuditIfNotExists,,AuditIfNotExists,
9ace2dbc-4b71-48b6-b2a7-428b0b2e3944,,BuiltIn,Internet of Things,IoT Central should use private link,"Azure Private Link lets you connect your virtual network to Azure services without a public IP address at the source or destination. The private link platform handles the connectivity between the consumer and services over the Azure backbone network. By mapping private endpoints to your IoT Central application instead of the entire service, you'll reduce your data leakage risks. Learn more about private links at: https://aka.ms/iotcentral-network-security-using-pe.",Azure_Security_Benchmark_v3.0_NS-2,MCSB-V2: Audit (Policy Default),"override: Deny,Audit,Disabled",Audit,,Audit,
d82101f3-f3ce-4fc5-8708-4c09f4009546,,BuiltIn,Internet of Things,IoT Hub device provisioning service instances should disable public network access,Disabling public network access improves security by ensuring that IoT Hub device provisioning service instance isn't exposed on the public internet. Creating private endpoints can limit exposure of the IoT Hub device provisioning instances. Learn more at: https://aka.ms/iotdpsvnet.,Azure_Security_Benchmark_v3.0_NS-2,MCSB-V2: Audit (Policy Default),"override: Deny,Audit,Disabled",Audit,,Audit,
df39c015-56a4-45de-b4a3-efe77bed320d,,BuiltIn,Internet of Things,IoT Hub device provisioning service instances should use private link,"Azure Private Link lets you connect your virtual network to Azure services without a public IP address at the source or destination. The Private Link platform handles the connectivity between the consumer and services over the Azure backbone network. By mapping private endpoints to the IoT Hub device provisioning service, data leakage risks are reduced. Learn more about private links at: https://aka.ms/iotdpsvnet.","Azure_Security_Benchmark_v3.0_NS-2,NIST_SP_800-53_R5_AC-17,NIST_SP_800-53_R5_AC-17(1),NIST_SP_800-53_R5_AC-4,NIST_SP_800-53_R5_SC-7,NIST_SP_800-53_R5_SC-7(3)","MCSB-V2: Audit (Policy Default),NIST-800-53: Audit (Policy Default)","override: Audit,Disabled",Audit,,Audit,
510ec8b2-cb9e-461d-b7f3-6b8678c31182,,BuiltIn,Internet of Things,Public network access for Azure Device Update for IoT Hub accounts should be disabled,Disabling the public network access property improves security by ensuring your Azure Device Update for IoT Hub accounts can only be accessed from a private endpoint.,Azure_Security_Benchmark_v3.0_NS-2,MCSB-V2: Audit (Policy Default),"override: Deny,Audit,Disabled",Audit,,Audit,
2d6830fb-07eb-48e7-8c4d-2a442b35f0fb,,BuiltIn,Internet of Things,Public network access on Azure IoT Hub should be disabled,Disabling the public network access property improves security by ensuring your Azure IoT Hub can only be accessed from a private endpoint.,Azure_Security_Benchmark_v3.0_NS-2,MCSB-V2: Audit (Policy Default),"override: Deny,Audit,Disabled",Audit,,Audit,
cd870362-211d-4cad-9ad9-11e5ea4ebbc1,,BuiltIn,Internet of Things,Public network access should be disabled for IoT Central,"To improve the security of IoT Central, ensure that it isn't exposed to the public internet and can only be accessed from a private endpoint. Disable the public network access property as described in https://aka.ms/iotcentral-restrict-public-access. This option disables access from any public address space outside the Azure IP range, and denies all logins that match IP or virtual network-based firewall rules. This reduces data leakage risks.",Azure_Security_Benchmark_v3.0_NS-2,MCSB-V2: Audit (Policy Default),"override: Deny,Audit,Disabled",Audit,,Audit,
383856f8-de7f-44a2-81fc-e5135b5c2aa4,,BuiltIn,Internet of Things,Resource logs in IoT Hub should be enabled,Audit enabling of resource logs. This enables you to recreate activity trails to use for investigation purposes; when a security incident occurs or when your network is compromised,"Azure_Security_Benchmark_v3.0_LT-3,ISO_IEC_27001_2022_9.1,NIST_CSF_v2.0_DE.AE_03,NIST_SP_800-53_R5_AU-12,NIST_SP_800-53_R5_AU-12(1),NIST_SP_800-53_R5_AU-6(4),NIST_SP_800-53_R5_AU-6(5)","MCSB: AuditIfNotExists (default: diagnosticsLogsInIoTHubMonitoringEffect),MCSB-V2: AuditIfNotExists (Policy Default),NIST-800-53: AuditIfNotExists (Policy Default),NIST CSF V2: AuditIfNotExists (default: effect-383856f8-de7f-44a2-81fc-e5135b5c2aa4),ISO/IEC 27001 2022: AuditIfNotExists (default: effect-383856f8-de7f-44a2-81fc-e5135b5c2aa4)","parameter: AuditIfNotExists,Disabled",AuditIfNotExists,"{""requiredRetentionDays-383856f8-de7f-44a2-81fc-e5135b5c2aa4"":""365"",""diagnosticsLogsInIoTHubRetentionDays"":""1"",""requiredRetentionDays"":""365""}",AuditIfNotExists,"{""requiredRetentionDays-383856f8-de7f-44a2-81fc-e5135b5c2aa4"":""365"",""diagnosticsLogsInIoTHubRetentionDays"":""1"",""requiredRetentionDays"":""365""}"
19ea9d63-adee-4431-a95e-1913c6c1c75f,,BuiltIn,Key Vault,[Preview]: Azure Key Vault Managed HSM should disable public network access,Disable public network access for your Azure Key Vault Managed HSM so that it's not accessible over the public internet. This can reduce data leakage risks. Learn more at: https://docs.microsoft.com/azure/key-vault/managed-hsm/private-link#allow-trusted-services-to-access-managed-hsm.,Azure_Security_Benchmark_v3.0_NS-2,MCSB-V2: Audit (Policy Default),"override: Deny,Audit,Disabled",Audit,,Audit,
59fee2f4-d439-4f1b-9b9a-982e1474bfd8,,BuiltIn,Key Vault,[Preview]: Azure Key Vault Managed HSM should use private link,Private link provides a way to connect Azure Key Vault Managed HSM to your Azure resources without sending traffic over the public internet. Private link provides defense in depth protection against data exfiltration. Learn more at: https://docs.microsoft.com/azure/key-vault/managed-hsm/private-link,Azure_Security_Benchmark_v3.0_NS-2,MCSB-V2: Audit (Policy Default),"override: Audit,Disabled",Audit,,Audit,
c39ba22d-4428-4149-b981-70acb31fc383,,BuiltIn,Key Vault,Azure Key Vault Managed HSM should have purge protection enabled,Malicious deletion of an Azure Key Vault Managed HSM can lead to permanent data loss. A malicious insider in your organization can potentially delete and purge Azure Key Vault Managed HSM. Purge protection protects you from insider attacks by enforcing a mandatory retention period for soft deleted Azure Key Vault Managed HSM. No one inside your organization or Microsoft will be able to purge your Azure Key Vault Managed HSM during the soft delete retention period.,"EU_2555_(NIS2)_2022_11,EU_2555_(NIS2)_2022_12,EU_2555_(NIS2)_2022_21,EU_2555_(NIS2)_2022_29,EU_2555_(NIS2)_2022_9",NIS2-EU-2022: Audit (default: effect-c39ba22d-4428-4149-b981-70acb31fc383),"parameter: Deny,Audit,Disabled",Audit,,Audit,
405c5871-3e91-4644-8a63-58e19d68ff5b,,BuiltIn,Key Vault,Azure Key Vault should disable public network access,Disable public network access for your key vault so that it's not accessible over the public internet. This can reduce data leakage risks. Learn more at: https://aka.ms/akvprivatelink.,Azure_Security_Benchmark_v3.0_NS-2,MCSB-V2: Audit (Policy Default),"override: Deny,Audit,Disabled",Audit,,Audit,
55615ac9-af46-4a59-874e-391cc3dfb490,,BuiltIn,Key Vault,Azure Key Vault should have firewall enabled or public network access disabled,"Enable the key vault firewall so that the key vault is not accessible by default to any public IPs or disable public network access for your key vault so that it's not accessible over the public internet. Optionally, you can configure specific IP ranges to limit access to those networks. Learn more at: https://docs.microsoft.com/azure/key-vault/general/network-security and https://aka.ms/akvprivatelink","Azure_Security_Benchmark_v3.0_DP-8,Azure_Security_Benchmark_v3.0_NS-2,EU_2555_(NIS2)_2022_21,NIST_SP_800-53_R5_AC-4,NIST_SP_800-53_R5_SC-7,NIST_SP_800-53_R5_SC-7(3)","MCSB: Audit (default: firewallShouldBeEnabledOnKeyVaultMonitoringEffect),MCSB-V2: Audit (Policy Default),NIST-800-53: Audit (default: effect-55615ac9-af46-4a59-874e-391cc3dfb490),NIS2-EU-2022: Audit (default: effect-55615ac9-af46-4a59-874e-391cc3dfb490)","parameter: Deny,Audit,Disabled",Audit,"{""restrictIPAddresses-55615ac9-af46-4a59-874e-391cc3dfb490"":""No"",""forbiddenIPAddresses-55615ac9-af46-4a59-874e-391cc3dfb490"":[],""allowedIPAddresses-55615ac9-af46-4a59-874e-391cc3dfb490"":[]}",Audit,"{""restrictIPAddresses-55615ac9-af46-4a59-874e-391cc3dfb490"":""No"",""forbiddenIPAddresses-55615ac9-af46-4a59-874e-391cc3dfb490"":[],""allowedIPAddresses-55615ac9-af46-4a59-874e-391cc3dfb490"":[]}"
12d4fa5e-1f9f-4c21-97a9-b99b3c6611b5,,BuiltIn,Key Vault,Azure Key Vault should use RBAC permission model,Enable RBAC permission model across Key Vaults. Learn more at: https://learn.microsoft.com/en-us/azure/key-vault/general/rbac-migration,"Azure_Security_Benchmark_v3.0_PA-7,NIST_CSF_v2.0_PR.AA","MCSB: Audit (Policy Default),MCSB-V2: Audit (Policy Default),NIST CSF V2: Audit (default: effect-12d4fa5e-1f9f-4c21-97a9-b99b3c6611b5)","parameter: Deny,Audit,Disabled",Audit,,Audit,
a6abeaec-4d90-4a02-805f-6b26c4d3fbe9,,BuiltIn,Key Vault,Azure Key Vaults should use private link,"Azure Private Link lets you connect your virtual networks to Azure services without a public IP address at the source or destination. The Private Link platform handles the connectivity between the consumer and services over the Azure backbone network. By mapping private endpoints to key vault, you can reduce data leakage risks. Learn more about private links at: https://aka.ms/akvprivatelink.","Azure_Security_Benchmark_v3.0_DP-8,Azure_Security_Benchmark_v3.0_NS-2,NIST_SP_800-53_R5_AC-17,NIST_SP_800-53_R5_AC-17(1),NIST_SP_800-53_R5_AC-4,NIST_SP_800-53_R5_SC-7,NIST_SP_800-53_R5_SC-7(3)","MCSB: Audit (default: privateEndpointShouldBeConfiguredForKeyVaultMonitoringEffect),MCSB-V2: Audit (assignment: privateEndpointShouldBeConfiguredForKeyVaultMonitoringEffect),NIST-800-53: Audit (default: effect-a6abeaec-4d90-4a02-805f-6b26c4d3fbe9)","parameter: Audit,Disabled",Audit,,Audit,
0a075868-4c26-42ef-914c-5bc007359560,1f3afdf9-d0c9-4c3d-847f-89da613e70a8\\certificatesValidityPeriodMonitoring,BuiltIn,Key Vault,Certificates should have the specified maximum validity period,Manage your organizational compliance requirements by specifying the maximum amount of time that a certificate can be valid within your key vault.,Azure_Security_Benchmark_v3.0_DP-7,MCSB: disabled (default: certificatesValidityPeriodMonitoringEffect),"parameter: Deny,Audit,Disabled",Disabled,"{""certificatesValidityPeriodInMonths"":12}",Disabled,"{""certificatesValidityPeriodInMonths"":12}"
0a075868-4c26-42ef-914c-5bc007359560,e3ec7e09-768c-4b64-882c-fcada3772047\\certificatesValidityPeriodMonitoring,BuiltIn,Key Vault,Certificates should have the specified maximum validity period,Manage your organizational compliance requirements by specifying the maximum amount of time that a certificate can be valid within your key vault.,Azure_Security_Benchmark_v3.0_DP-7,MCSB-V2: Disabled (default: certificatesValidityPeriodMonitoringEffect),"parameter: Deny,Audit,Disabled",Disabled,,Disabled,
0a075868-4c26-42ef-914c-5bc007359560,179d1daa-458f-4e47-8086-2a68d0d6c38f\\0a075868-4c26-42ef-914c-5bc007359560,BuiltIn,Key Vault,Certificates should have the specified maximum validity period,Manage your organizational compliance requirements by specifying the maximum amount of time that a certificate can be valid within your key vault.,NIST_SP_800-53_R5_IA-5,NIST-800-53: audit (default: effect-0a075868-4c26-42ef-914c-5bc007359560),"parameter: Deny,Audit,Disabled",Audit,"{""maximumValidityInMonths-0a075868-4c26-42ef-914c-5bc007359560"":12}",Audit,"{""maximumValidityInMonths-0a075868-4c26-42ef-914c-5bc007359560"":12}"
0a075868-4c26-42ef-914c-5bc007359560,e3ec7e09-768c-4b64-882c-fcada3772047\\CertificatesSpecifiedMaximumValidityPeriod,BuiltIn,Key Vault,Certificates should have the specified maximum validity period,Manage your organizational compliance requirements by specifying the maximum amount of time that a certificate can be valid within your key vault.,Azure_Security_Benchmark_v3.0_DP-7,MCSB-V2: Audit (Policy Default),"override: Deny,Audit,Disabled",Audit,,Audit,
f772fb64-8e40-40ad-87bc-7706e1949427,,BuiltIn,Key Vault,Certificates should not expire within the specified number of days,Manage certificates that will expire within a specified number of days to ensure your organization has sufficient time to rotate the certificate prior to expiration.,Azure_Security_Benchmark_v3.0_DP-7,MCSB-V2: Audit (Policy Default),"override: Deny,Audit,Disabled",Audit,,Audit,
152b15f7-8e1f-4c1f-ab71-8c010ba5dbc0,,BuiltIn,Key Vault,Key Vault keys should have an expiration date,Cryptographic keys should have a defined expiration date and not be permanent. Keys that are valid forever provide a potential attacker with more time to compromise the key. It is a recommended security practice to set expiration dates on cryptographic keys.,"Azure_Security_Benchmark_v3.0_DP-6,EU_2555_(NIS2)_2022_21,NIST_SP_800-53_R5_IA-5","MCSB: Disabled (default: keysExpirationSetEffect),MCSB-V2: Disabled (default: keysExpirationSetEffect),NIST-800-53: Disabled (assignment: effect-152b15f7-8e1f-4c1f-ab71-8c010ba5dbc0),NIS2-EU-2022: Disabled (assignment: effect-152b15f7-8e1f-4c1f-ab71-8c010ba5dbc0)","parameter: Deny,Audit,Disabled",Disabled,,Disabled,
98728c90-32c7-4049-8429-847dc0f4fe37,,BuiltIn,Key Vault,Key Vault secrets should have an expiration date,Secrets should have a defined expiration date and not be permanent. Secrets that are valid forever provide a potential attacker with more time to compromise them. It is a recommended security practice to set expiration dates on secrets.,"Azure_Security_Benchmark_v3.0_DP-6,EU_2555_(NIS2)_2022_21,NIST_SP_800-53_R5_IA-5","MCSB: Disabled (default: secretsExpirationSetEffect),MCSB-V2: Disabled (default: secretsExpirationSetEffect),NIST-800-53: Disabled (assignment: effect-98728c90-32c7-4049-8429-847dc0f4fe37),NIS2-EU-2022: Disabled (assignment: effect-98728c90-32c7-4049-8429-847dc0f4fe37)","parameter: Deny,Audit,Disabled",Disabled,,Disabled,
0b60c0b2-2dc2-4e1c-b5c9-abbed971de53,,BuiltIn,Key Vault,Key vaults should have deletion protection enabled,Malicious deletion of a key vault can lead to permanent data loss. You can prevent permanent data loss by enabling purge protection and soft delete. Purge protection protects you from insider attacks by enforcing a mandatory retention period for soft deleted key vaults. No one inside your organization or Microsoft will be able to purge your key vaults during the soft delete retention period. Keep in mind that key vaults created after September 1st 2019 have soft-delete enabled by default.,"Azure_Security_Benchmark_v3.0_DP-8,EU_2555_(NIS2)_2022_11,EU_2555_(NIS2)_2022_12,EU_2555_(NIS2)_2022_21,EU_2555_(NIS2)_2022_29,EU_2555_(NIS2)_2022_9,NIST_CSF_v2.0_PR.DS_01,NIST_SP_800-53_R5_CP-9","MCSB: Audit (default: keyVaultsShouldHavePurgeProtectionEnabledMonitoringEffect),MCSB-V2: Audit (Policy Default),NIST-800-53: Audit (default: effect-0b60c0b2-2dc2-4e1c-b5c9-abbed971de53),NIS2-EU-2022: Audit (default: effect-0b60c0b2-2dc2-4e1c-b5c9-abbed971de53),NIST CSF V2: Audit (default: effect-0b60c0b2-2dc2-4e1c-b5c9-abbed971de53)","parameter: Deny,Audit,Disabled",Audit,,Audit,
1e66c121-a66a-4b1f-9b83-0fd99bf0fc2d,,BuiltIn,Key Vault,Key vaults should have soft delete enabled,"Deleting a key vault without soft delete enabled permanently deletes all secrets, keys, and certificates stored in the key vault. Accidental deletion of a key vault can lead to permanent data loss. Soft delete allows you to recover an accidentally deleted key vault for a configurable retention period.","Azure_Security_Benchmark_v3.0_DP-8,NIST_SP_800-53_R5_CP-9","MCSB: Audit (default: keyVaultsShouldHaveSoftDeleteEnabledMonitoringEffect),MCSB-V2: Audit (Policy Default),NIST-800-53: Audit (default: effect-1e66c121-a66a-4b1f-9b83-0fd99bf0fc2d)","parameter: Deny,Audit,Disabled",Audit,,Audit,
75c4f823-d65c-4f29-a733-01d0077fdbcb,,BuiltIn,Key Vault,Keys should be the specified cryptographic type RSA or EC,"Some applications require the use of keys backed by a specific cryptographic type. Enforce a particular cryptographic key type, RSA or EC, in your environment.","EU_2555_(NIS2)_2022_11,EU_2555_(NIS2)_2022_12,EU_2555_(NIS2)_2022_21,EU_2555_(NIS2)_2022_29",NIS2-EU-2022: Audit (default: effect-75c4f823-d65c-4f29-a733-01d0077fdbcb),"parameter: Deny,Audit,Disabled",Audit,"{""allowedKeyTypes-75c4f823-d65c-4f29-a733-01d0077fdbcb"":[""RSA"",""RSA-HSM"",""EC"",""EC-HSM""]}",Audit,"{""allowedKeyTypes-75c4f823-d65c-4f29-a733-01d0077fdbcb"":[""RSA"",""RSA-HSM"",""EC"",""EC-HSM""]}"
d8cf8476-a2ec-4916-896e-992351803c44,,BuiltIn,Key Vault,Keys should have a rotation policy ensuring that their rotation is scheduled within the specified number of days after creation.,Manage your organizational compliance requirements by specifying the maximum number of days after key creation until it must be rotated.,"Azure_Security_Benchmark_v3.0_DP-6,EU_2555_(NIS2)_2022_21","MCSB-V2: Audit (Policy Default),NIS2-EU-2022: Audit (default: effect-d8cf8476-a2ec-4916-896e-992351803c44)","parameter: Audit,Disabled",Audit,"{""maximumDaysToRotate-d8cf8476-a2ec-4916-896e-992351803c44"":365}",Audit,"{""maximumDaysToRotate-d8cf8476-a2ec-4916-896e-992351803c44"":365}"
49a22571-d204-4c91-a7b6-09b1a586fbc9,,BuiltIn,Key Vault,Keys should have the specified maximum validity period,Manage your organizational compliance requirements by specifying the maximum amount of time in days that a key can be valid within your key vault.,Azure_Security_Benchmark_v3.0_DP-6,MCSB-V2: Audit (Policy Default),"override: Deny,Audit,Disabled",Audit,,Audit,
c26e4b24-cf98-4c67-b48b-5a25c4c69eb9,,BuiltIn,Key Vault,Keys should not be active for longer than the specified number of days,"Specify the number of days that a key should be active. Keys that are used for an extended period of time increase the probability that an attacker could compromise the key. As a good security practice, make sure that your keys have not been active longer than two years.",Azure_Security_Benchmark_v3.0_DP-6,MCSB-V2: Audit (Policy Default),"override: Deny,Audit,Disabled",Audit,,Audit,
